{
    "status": {
        "message": "success",
        "code": 200
    },
    "result": {
        "major": "平面设计",
        "surname": "金",
        "social_exp_objs": [],
        "college": "马里兰艺术设计学院",
        "all_cert_objs": [
            {
                "cert_name": "北京市优秀毕业生"
            }
        ],
        "resume_type": "2",
        "has_oversea_edu": "1",
        "cert_objs": [],
        "skills_objs": [],
        "education_objs": [
            {
                "edu_content": "旅行与制图\n跳舞\n分享想法\n音乐\n学士学位|视觉传达整合设计实验班20142018\n读书批判思维\n北京服装学院(BIFT)",
                "edu_major": "平面设计",
                "end_date": "2020",
                "edu_college": "马里兰艺术设计学院",
                "edu_degree": "硕士",
                "edu_degree_norm": "硕士研究生",
                "edu_college_type": "4",
                "start_date": "2018"
            }
        ],
        "cont_award": "其中包含个人经验,设计牧育讲座分析以及国内外\n2019年美国平面设计协会\n优秀设计作品的分析与推荐。\nStudent Design Competition,\n2019年\n马里兰艺术学院研究生助教\n美国马里兰\n视觉识别类,小组冠军\n·研究生阶段担任本科大四平面设计课程版式设计课程教授\n2019年美国平面设计协会\nMaureen Weiss的课程助教,在课程中与教授合作制定课程内容,\nBlue Ridge's annual Flux\n·参与小组的作业分析与讲解。\nStudent Design Competition.\n2019年KUD0 S Design设计实习\n美国纽约\n包装类,小组冠军\n·与高级设计师合作并辅助其完成设计项目;\n2018年北京市优秀毕业生\n·其中有参与为客户项目提出设计概念:\n2018年国家励志奖学金\n进行设计项目以及部分项目的创意部分的进一步完善:\n版式调整,插画团,以及摄影图片的效果调整。\n2019年\n马里兰艺术学院自由设计师美国马里兰\nskill\n,参与由马里兰艺术学院官方编辑整理的设计杂志\nFull Bleed:A Journal of Art&Design Journal的版式与文字设计\n设计\nBranding\nMotionGraphic\n2019年\n电影品牌项目\n自由设计师美国马里兰\nTypography\n·2019与电影系研究生的合作项目,为其研究生毕业作品影片设计\nLaser cutting\n海报、EPK等相关视觉宣传。\nograpn\n软件\n2016年\n中国建设银行\n自由设计师\n中国北京\nInDesign\nAfter Effects\n·为美国运通百夫长信用金卡设计相关视觉,\nHTML CSS\n包括卡面文字排版,包装及卡面的视觉呈现方式。\ninterests",
        "resume_integrity": "34",
        "training_objs": [],
        "email": "cjin02@mica.edu",
        "apply_job": "用户体验设计师",
        "lang_objs": [],
        "grad_time": "2020",
        "degree": "硕士",
        "proj_exp_objs": [],
        "phone": "17801011020",
        "resume_parse_time": "2022-12-21 17:46:58",
        "raw_text": "金丛佳\nwork\n应聘岗位:用户体验设计师\n2020年\n汉艺国际教育\n兼职辅导老师中国北京\n17801011020\ncjin02@mica.edu\n·针对国外院校视觉类课程为学生编写学习材料:\n·并且进行作品集辅导于提升。\ncongjiajin.com\n2020年\n最毕设教育平台自由撰稿人\n中国广东\n·为最毕设教育设计平台撰写有关设计类的文章分享:\n获奖经历\n·其中包含个人经验,设计牧育讲座分析以及国内外\n2019年美国平面设计协会\n优秀设计作品的分析与推荐。\nStudent Design Competition,\n2019年\n马里兰艺术学院研究生助教\n美国马里兰\n视觉识别类,小组冠军\n·研究生阶段担任本科大四平面设计课程版式设计课程教授\n2019年美国平面设计协会\nMaureen Weiss的课程助教,在课程中与教授合作制定课程内容,\nBlue Ridge's annual Flux\n·参与小组的作业分析与讲解。\nStudent Design Competition.\n2019年KUD0 S Design设计实习\n美国纽约\n包装类,小组冠军\n·与高级设计师合作并辅助其完成设计项目;\n2018年北京市优秀毕业生\n·其中有参与为客户项目提出设计概念:\n2018年国家励志奖学金\n进行设计项目以及部分项目的创意部分的进一步完善:\n版式调整,插画团,以及摄影图片的效果调整。\n2019年\n马里兰艺术学院自由设计师美国马里兰\nskill\n,参与由马里兰艺术学院官方编辑整理的设计杂志\nFull Bleed:A Journal of Art&Design Journal的版式与文字设计\n设计\nBranding\nMotionGraphic\n2019年\n电影品牌项目\n自由设计师美国马里兰\nTypography\n·2019与电影系研究生的合作项目,为其研究生毕业作品影片设计\nLaser cutting\n海报、EPK等相关视觉宣传。\nograpn\n软件\n2016年\n中国建设银行\n自由设计师\n中国北京\nInDesign\nAfter Effects\n·为美国运通百夫长信用金卡设计相关视觉,\nHTML CSS\n包括卡面文字排版,包装及卡面的视觉呈现方式。\ninterests\neducation\n硕士学位|平面设计专业2018-2020\n旅行与制图\n跳舞\n马里兰艺术设计学院(MICA)\n分享想法\n音乐\n学士学位|视觉传达整合设计实验班20142018\n读书批判思维\n北京服装学院(BIFT)\nCONGJIA JIN\nBrandingIMotionGraphic Publcation\nCONTACT\nEXPERIENCE\n+86780101020\nPart-time Tuto\nciin02@mica.edu\ncongjiajin.com\ndesign\nFreelance Writer\nAWARDS\na,202\nesignto\nAIGA Blue Ridge's annual\nanalysis of professional lecture and giving recommendations.\nGraduate Teaching Intern\nPak9gn9we2wCgmpeiton\nMaryland Institute College of Art Baltimore.Maryland.2019\nAssisted professor Maureen Weiss in sophomore Graphic Design\nBeo0epcrngGaduaes\nStudio l and Typography l.Participated in critiques for juniors.\nDesignIntern\nNational Endeavor Scholarship20\nKUDOS Design Collaboratory,NY,USA.2019\nProvided assistance to senior designers.Formulated desigr\nSKILLS\nxked on\nDesign\nBranding\nFreelance Designer\nMotion Graphic\nManda\nPublication\ndesigned andedited by students.\nLaser\nPhotography\nosiesiEPKandiebsieGesgi\nSoftware\nChina Construction Bank,Beijing.China.2016\nAfter E\nng the typography.packaging\nCinema4D\nand the display of thecard.\nPhotoshop\nDesign Project Group Leader\nLightroom\nCreative Coding\nimage witha theme of Soitude'.Included\nHTML CSS\nan expanded concept.design for a logo and visual identity.\nOrganized and assigned tasks to each member for completion\nof their work.\nINTERESTS\nTravel&Mapping\nEDUCATION\nMFA|Graphic Design 2018-2020\nSharingldeas\nMaryland Institute College of Art(MICA)\nMusic isa must\nTaking Critisim",
        "cont_basic_info": "金丛佳\nwork\n应聘岗位:用户体验设计师\n2020年\n汉艺国际教育\n兼职辅导老师中国北京\n17801011020\ncjin02@mica.edu\n·针对国外院校视觉类课程为学生编写学习材料:\n·并且进行作品集辅导于提升。\ncongjiajin.com\n2020年\n最毕设教育平台自由撰稿人\n中国广东\n·为最毕设教育设计平台撰写有关设计类的文章分享:",
        "name": "金丛佳",
        "job_exp_objs": [],
        "resume_name": "cv20221221_174656835_475.pdf",
        "cont_education": "硕士学位|平面设计专业2018-2020\n旅行与制图\n跳舞\n马里兰艺术设计学院(MICA)\n分享想法\n音乐\n学士学位|视觉传达整合设计实验班20142018\n读书批判思维\n北京服装学院(BIFT)",
        "college_type": "4"
    },
    "eval": {
        "salary": 10000
    },
    "tags": {
        "industries": [],
        "pos_types": [],
        "pos_tags": [],
        "skills_tags": []
    }
}